{
  "version": "1.0.0",
  "dataset": "wheelbases",
  "license": "CC BY 4.0",
  "method": "Fields come from the linked manufacturer sources on the retrieval date; where a manufacturer is silent, a named authorized retailer is used and that record says so. Each source's covers list maps it to the fields it supports. Prices are list prices read manually from the manufacturers' own store pages (URL and date in the record) - no feeds or endpoints are scraped, and MOZA prices are withheld until an authorized data source exists. Null means no citable figure from a permitted source; the notes say why.",
  "records": [
    {
      "brand": "Fanatec",
      "model": "CSL DD",
      "variant": "5 Nm (QR2 Lite, 90 W PSU)",
      "lifecycle": "current",
      "productType": "base",
      "motorType": "Custom direct-drive motor with FluxBarrier technology and carbon-fibre composite motor shaft",
      "torque": { "peakNm": 5, "holdingNm": null, "claimType": "peak", "note": "Official wording: standard peak torque is 5 Nm; the Boost Kit 180 (sold separately) unlocks 8 Nm. No holding figure is published." },
      "slewRate": null,
      "encoder": { "tech": "High-resolution contactless Hall position sensor", "resolution": null },
      "rotationDeg": "2520 (electronically limited, adjustable)",
      "platforms": {
        "pc": true,
        "ps": { "supported": false, "condition": "Fanatec: not compatible with any PlayStation console and cannot be upgraded" },
        "xbox": { "supported": true, "condition": "Requires an Xbox-licensed Fanatec steering wheel (the Microsoft security chip is in the wheel)" }
      },
      "quickRelease": "QR2 Lite Base-Side (Type-C) preinstalled; accepts QR2 Lite, QR2 and QR2 Pro wheel-sides",
      "mounting": "T-nut rails on sides and bottom (4x M6 T-nuts included); optional table clamp sold separately (5-60 mm desks)",
      "dimensions": null,
      "weightKg": null,
      "psu": "90 W regional power supply included",
      "included": ["CSL DD wheel base", "QR2 Lite Base-Side (Type-C)", "90 W power supply", "4x T-nuts", "USB-C to USB-A cable", "Quick guide"],
      "requiredNotIncluded": ["Fanatec steering wheel with QR2 wheel-side", "Pedals", "Rig or table clamp (sold separately)"],
      "warranty": "3-year Fanatec limited warranty",
      "priceUSD": { "amount": 399.99, "source": "https://www.fanatec.com/us/en/p/wheel-bases/csl_dd_qr2l_90_us/csl-dd-qr2l-5-nm-us", "retrieved": "2026-07-18", "note": "US store list price" },
      "sources": [
        { "url": "https://www.fanatec.com/us/en/p/wheel-bases/csl_dd_qr2l_90_us/csl-dd-qr2l-5-nm-us", "kind": "manufacturer product page", "retrieved": "2026-07-18", "covers": ["torque", "motor", "encoder", "rotation", "platforms", "quick release", "mounting", "psu", "included", "price"] },
        { "url": "https://help.fanatec.com/hc/en-us/articles/33445478028305-Fanatec-Consumer-Guarantee", "kind": "manufacturer support policy", "retrieved": "2026-07-18", "covers": ["warranty"] }
      ],
      "confidence": "high",
      "lastVerified": "2026-07-18",
      "notes": "Slew rate, encoder resolution, dimensions and weight are not published on the current product page or quick guide (nulls)."
    },
    {
      "brand": "Fanatec",
      "model": "CSL DD",
      "variant": "8 Nm (Boost Kit 180)",
      "lifecycle": "current",
      "productType": "base",
      "motorType": "Custom direct-drive motor with FluxBarrier technology and carbon-fibre composite motor shaft",
      "torque": { "peakNm": 8, "holdingNm": null, "claimType": "peak", "note": "Same motor as the 5 Nm CSL DD; the included 180 W Boost Kit 180 power supply unlocks 8 Nm peak torque. No holding figure is published." },
      "slewRate": null,
      "encoder": { "tech": "High-resolution contactless Hall position sensor", "resolution": null },
      "rotationDeg": "2520 (electronically limited, adjustable)",
      "platforms": {
        "pc": true,
        "ps": { "supported": false, "condition": "Fanatec: not compatible with any PlayStation console and cannot be upgraded" },
        "xbox": { "supported": true, "condition": "Requires an Xbox-licensed Fanatec steering wheel" }
      },
      "quickRelease": "QR2 Lite Base-Side (Type-C) preinstalled",
      "mounting": "T-nut rails on sides and bottom (4x M6 T-nuts included); optional table clamp sold separately (5-60 mm desks)",
      "dimensions": null,
      "weightKg": null,
      "psu": "Boost Kit 180 (180 W) included; Fanatec warns the warranty is void if other power supplies are used",
      "included": ["CSL DD wheel base", "Boost Kit 180 (180 W PSU)", "QR2 Lite Base-Side (Type-C)", "4x T-nuts", "USB-C to USB-A cable", "Quick guide"],
      "requiredNotIncluded": ["Fanatec steering wheel with QR2 wheel-side", "Pedals", "Rig or table clamp (sold separately)"],
      "warranty": "3-year Fanatec limited warranty",
      "priceUSD": { "amount": 479.99, "source": "https://www.fanatec.com/us/en/p/wheel-bases/csl_dd_qr2l_8nm_us/csl-dd-qr2-lite-8-nm-us", "retrieved": "2026-07-18", "note": "Sale price; regular combined price shown as $519.98. Standalone Boost Kit 180 upgrade: $59.99" },
      "sources": [
        { "url": "https://www.fanatec.com/us/en/p/wheel-bases/csl_dd_qr2l_8nm_us/csl-dd-qr2-lite-8-nm-us", "kind": "manufacturer product page", "retrieved": "2026-07-18", "covers": ["torque", "platforms", "quick release", "psu", "included", "price"] },
        { "url": "https://www.fanatec.com/us/en/p/sim-racing-accessories/bk180_us/boost-kit-180-8nm-us", "kind": "manufacturer product page", "retrieved": "2026-07-18", "covers": ["psu", "upgrade price"] },
        { "url": "https://help.fanatec.com/hc/en-us/articles/33445478028305-Fanatec-Consumer-Guarantee", "kind": "manufacturer support policy", "retrieved": "2026-07-18", "covers": ["warranty"] }
      ],
      "confidence": "high",
      "lastVerified": "2026-07-18",
      "notes": "Boost Kit 180 is compatible only with CSL DD and GT DD Pro. Slew rate, encoder resolution, dimensions and weight are not published (nulls)."
    },
    {
      "brand": "Fanatec",
      "model": "Gran Turismo DD Pro",
      "variant": "Wheel Base (8 Nm, QR2)",
      "lifecycle": "current",
      "productType": "base",
      "motorType": "Custom direct-drive motor with FluxBarrier technology",
      "torque": { "peakNm": 8, "holdingNm": null, "claimType": "peak", "note": "8 Nm peak torque with the included Boost Kit 180. Fanatec's guide also documents a 5 Nm version; only the 8 Nm base is on the current US store." },
      "slewRate": null,
      "encoder": { "tech": "High-resolution contactless Hall position sensor (Fanatec: same as Podium DD1)", "resolution": null },
      "rotationDeg": "2520 (electronically limited, adjustable)",
      "platforms": {
        "pc": true,
        "ps": { "supported": true, "condition": "Officially PlayStation-licensed (PS5 and PS4); the license resides in the base" },
        "xbox": { "supported": true, "condition": "Per Fanatec's compatibility guide: works on Xbox with an Xbox-licensed Fanatec steering wheel attached; the current product page itself is silent on Xbox" }
      },
      "quickRelease": "QR2 Lite Base-Side (Type-C) preinstalled",
      "mounting": "T-nut rails on sides and bottom (4x M6 T-nuts included); optional table clamp sold separately (5-60 mm desks)",
      "dimensions": null,
      "weightKg": null,
      "psu": "Boost Kit 180 (180 W) included with this SKU",
      "included": ["GT DD Pro wheel base", "QR2 Lite Base-Side (Type-C)", "Boost Kit 180 PSU (regional)", "4x T-nuts", "PlayStation button caps", "USB cable", "Quick guide"],
      "requiredNotIncluded": ["Steering wheel (any compatible Fanatec wheel - the PlayStation license resides in the base)", "Pedals", "Rig or table clamp (sold separately)"],
      "warranty": "3-year Fanatec limited warranty",
      "priceUSD": { "amount": 599.99, "source": "https://www.fanatec.com/us/en/p/wheel-bases/crd-9020006-us/gran-turismo-dd-pro-wheel-base-qr2-us", "retrieved": "2026-07-18", "note": "Standalone wheel-base package, not the similarly named wheel-and-pedal bundles; listed on backorder" },
      "sources": [
        { "url": "https://www.fanatec.com/us/en/p/wheel-bases/crd-9020006-us/gran-turismo-dd-pro-wheel-base-qr2-us", "kind": "manufacturer product page", "retrieved": "2026-07-18", "covers": ["torque", "encoder", "rotation", "PlayStation licensing", "quick release", "psu", "included", "price"] },
        { "url": "https://www.fanatec.com/us/en/explorer/products/racing-wheels-wheel-bases/gtdd-pro-wheel-base-guide/", "kind": "manufacturer guide", "retrieved": "2026-07-18", "covers": ["Xbox condition", "5 Nm version"] },
        { "url": "https://help.fanatec.com/hc/en-us/articles/33445478028305-Fanatec-Consumer-Guarantee", "kind": "manufacturer support policy", "retrieved": "2026-07-18", "covers": ["warranty"] }
      ],
      "confidence": "medium",
      "lastVerified": "2026-07-18",
      "notes": "Xbox support is sourced from Fanatec's own guide rather than the SKU page, which lowers confidence. Dimensions, weight, slew rate and encoder resolution are not published (nulls)."
    },
    {
      "brand": "Fanatec",
      "model": "ClubSport DD",
      "variant": "15 Nm holding",
      "lifecycle": "current",
      "productType": "base",
      "motorType": "Custom German-designed direct-drive servo motor with skewed rotor magnets and FluxBarrier technology; passively cooled",
      "torque": { "peakNm": null, "holdingNm": 15, "claimType": "holding", "note": "Official figure is 15 Nm holding torque, raised from 12 Nm by a free firmware update (Fanatec App, May 2026). Fanatec's 'More Torque, Same Hardware' page frames both the old and new figures as holding torque; no separate peak figure is published." },
      "slewRate": null,
      "encoder": { "tech": "High-resolution contactless Hall position sensor", "resolution": null },
      "rotationDeg": "2520 (electronically adjustable)",